{
	"FirmwareId":	3,
	"DeviceType":	1,
	"Model":	"RAD-ÿ\u0006\u0001R",
	"FindMe":	10,
	"Switch":	3,
	"Mode":	31,
	"FanSpeed":	31,
	"TemperatureSetting":	4128,
	"IndoorTemperature":	40,
	"SleepModeRemainingTime":	1440,
	"ScheduleOn":	1440,
	"ScheduleOff":	1440,
	"MildewProof":	3,
	"QuickMode":	3,
	"PowerSaving":	3,
	"RemoteControlProhibit":	63,
	"ControlTone":	3,
	"PowerConsumption":	65535,
	"TaiseiaError":	85,
	"FilterElapsedHour":	800,
	"CleanSwitch":	3,
	"CleanNotification":	3,
	"CleanStatus":	7,
	"Checksum":	245,
	"IndoorUnitInfo":	"H65535V255",
	"OutdoorUnitInfo":	"H65535V255",
	"Error":	0,
	"WiFiSSID":	"<ssid>",
	"FirmwareVersion":	"6.0.032",
	"FirmwareCode":	53,
	"SystemTimestamp":	7496,
	"RequestTimestamp":	1789574544,
	"Timestamp":	1789574545
}